{
  "$schema": "https://json-schema.org/draft/2020-12/schema",
  "title": "SyntheticCustomerProfile",
  "type": "object",
  "additionalProperties": false,
  "required": [
    "id",
    "public_id",
    "customer_profile_number",
    "user_id",
    "customer_name",
    "is_synthetic",
    "data_classification",
    "created_at"
  ],
  "properties": {
    "id": {"type": "integer", "minimum": 1},
    "public_id": {"type": "string", "format": "uuid"},
    "customer_profile_number": {
      "type": "string",
      "pattern": "^SYN-CUSTOMER-[0-9]{3}$"
    },
    "user_id": {"type": "integer", "minimum": 1},
    "customer_name": {"type": "string", "minLength": 1},
    "is_synthetic": {"const": true},
    "data_classification": {"const": "synthetic"},
    "created_at": {"type": "string", "format": "date-time"}
  }
}
